,id_orig,year_orig,year,author_orig,author,title_orig,title,genre,source,title_short
1113,SC1250,1853,1853,Maillard Annette Marie,Maillard Annette Marie,Miles Tremenhere A novel,Miles Tremenhere [A novel] ..,,,Miles Tremenhere
1114,SC1251,1853,1853,Reynolds George William McArthur,"Reynolds, George W. M. (George William MacArthur)",Mary Price or the memoirs of a servant maid,Mary Price ; or the memoirs of a servant maid,,,Mary Price
1115,SC1253,1853,1853,"Tautphoeus, Baroness Jemima Montgomery Baroness","Tautphoeus, Baroness Jemima Montgomery Baroness",Cyrilla a tale,Cyrilla : a tale,,,Cyrilla
1117,SC1258,1853,1853,"Yonge, Charlotte Mary","Yonge, Charlotte Mary",The Heir of Redclyffe By the Author of The Two Guardians In Two Volumes,The Heir of Redclyffe. By the Author of The Two Guardians ... In Two Volumes,,,The Heir of Redclyffe
1118,SC1259,1854,1854,Alexander Mrs,Alexander Mrs,Kate Vernon a tale,Kate Vernon : a tale,,,Kate Vernon
1119,SC1260,1854,1854,Coke Henry J Henry John 1827 1916,Coke Henry John,High and low or Life s chances and changes,"High and low; or, Life's chances and changes",,,High and low
1120,SC1261,1854,1854,Crowe Catherine 1800 1876,"Crowe, Catherine",Linny Lockwood,Linny Lockwood ..,,,Linny Lockwood
1121,SC1262,1854,1854,"Dickens, Charles","Dickens, Charles",Hard Times For These Times By Charles Dickens,Hard Times. For These Times. By Charles Dickens,Industrial,"Allison, Sarah, Ryan Heuser, Matthew Jockers, Franco Moretti, Michael Witmore. ""Quantitative Formalism: an Experiment."" Stanford: Stanford Literary Lab, 2011. Print. | Sutherland, John. The Longman Companion to Victorian Fiction. 2nd ed. Harlow, England: Pearson Longman, 2009.",Hard Times
1122,SC1263,1854,1854,Fullom S W Stephen Watson d 1872,"Fullom, Stephen Watson",The great highway a story of the world s struggles,The great highway : a story of the world's struggles,,,The great highway
1123,SC1264,1854,1854,Gibson Charles Bernard 1808 1885,"Gibson, Charles Bernard",The last Earl of Desmond a historical romance of 1599 1603 In two volumes,The last Earl of Desmond: : a historical romance of 1599-1603. ... In two volumes. ..,Historical,title inference,The last Earl of Desmond
1124,SC1265,1854,1854,Grant James 1822 1887,"Grant, James (1822)",Philip Rollo or The Scottish musketeers,"Philip Rollo, or, The Scottish musketeers",,,Philip Rollo
1125,SC1266,1854,1854,"Grant, Louisa Keir","Grant, Louisa Keir",Charles Stanley a novel,Charles Stanley : a novel,,,Charles Stanley
1126,SC1267,1854,1854,Hall Frederick J Mrs,Hall Frederick J Mrs,The next of kin a novel in three volumes,The next of kin : a novel in three volumes,,,The next of kin
1127,SC1268,1854,1854,Hamley Edward Bruce Sir 1824 1893,"Hamley, Edward Bruce",Lady Lee s widowhood,Lady Lee's widowhood,,,Lady Lee's widowhood
1128,SC1269,1854,1854,"Heighway, Osborn W. Trenery","Heighway, Osborn W. Trenery",Adeline or the mysteries romance and realities of Jewish life,"Adeline, or, the mysteries, romance, and realities of Jewish life",,,Adeline
1129,SC1270,1854,1854,James G P R George Payne Rainsford 1801 1860,"James, George Payne Rainsford",Ticonderoga or The Black Eagle A tale of times not long past,"Ticonderoga; or, The Black Eagle. A tale of times not long past",,,Ticonderoga
1130,SC1271,1854,1854,Kettle Rosa Mackenzie d 1895,"Kettle, Rosa Mackenzie",Lewell pastures,Lewell pastures,,,Lewell pastures
1131,SC1272,1854,1854,Lamington Alexander Dundas Ross Wishart Cochrane Baillie Baron 1816 1890,"Lamington, Baron Alexander Dundas Ross Wishart Cochrane Baillie",Florence the beautiful,"Florence, the beautiful",,,"Florence, the beautiful"
1132,SC1273,1854,1854,"Marsh, Caldwell Anne","Marsh, Caldwell Anne",Aubrey,Aubrey,,,Aubrey
1133,SC1274,1854,1854,McGauran,McGauran,Trial and triumph a novel,Trial and triumph : a novel,,,Trial and triumph
1134,SC1275,1854,1854,"Mitford, Mary Russell","Mitford, Mary Russell",Atherton and other tales,Atherton and other tales,,,Atherton and other tales
1135,SC1276,1854,1854,"Ponsonby, Lady Emily Lady","Ponsonby, Lady Emily",Edward Willoughby a tale,Edward Willoughby : a tale,,,Edward Willoughby
1136,SC1277,1854,1854,Reynolds George W M George William MacArthur 1814 1879,"Reynolds, George W. M. (George William MacArthur)",Joseph Wilmot or The memoirs of a man servant,"Joseph Wilmot, or, The memoirs of a man-servant",,,Joseph Wilmot
1137,SC1278,1854,1854,Robinson Emma 1814 1890,"Robinson, Emma",Westminster Abbey or The day of the reformation,"Westminster Abbey : or, The day of the reformation",,,Westminster Abbey
1138,SC1279,1854,1854,Sewell Elizabeth Missing 1815 1906,"Sewell, Elizabeth Missing",Katharine Ashton,Katharine Ashton,,,Katharine Ashton
1139,SC1280,1854,1854,"Sheppard, Elizabeth Sara","Sheppard, Elizabeth Sara",Counterparts or The cross of love,"Counterparts, or, The cross of love",,,Counterparts
1140,SC1281,1854,1854,"Strickland, Agnes","Strickland, Agnes",The pilgrims of Walsingham or Tales of the middle ages An historical romance By Agnes Strickland,"The pilgrims of Walsingham: or, Tales of the middle ages. An historical romance. By Agnes Strickland...",Historical,title inference,The pilgrims of Walsingham
1141,SC1283,1854,1854,"Thackeray, William Makepeace","Thackeray, William Makepeace",The Newcomes Memoirs of a Most Respectable Family Edited by Arthur Pendennis Esq With Illustrations on Steel and Wood by Richard Doyle,"The Newcomes. Memoirs of a Most Respectable Family. Edited by Arthur Pendennis, Esq. With Illustrations on Steel and Wood by Richard Doyle",,,The Newcomes
1142,SC1286,1854,1854,Whyte Melville G J George John 1821 1878,"Whyte, Melville George John",Tilbury Nogo or Passages in the life of an unsuccessful man,"Tilbury Nogo; or, Passages in the life of an unsuccessful man",,,Tilbury Nogo
1143,SC1287,1855,1855,Anonymous,Anonymous,Antipodes or the new existence a tale of real life,"Antipodes, or, the new existence : a tale of real life",,,Antipodes
1144,SC1288,1855,1855,"Armstrong, Francis Claudius","Armstrong, Francis Claudius",The warhawk A tale of the sea By F Claudius Armstrong in three volumes,The warhawk : A tale of the sea. By F. Claudius Armstrong ... in three volumes,,,The warhawk
1145,SC1289,1855,1855,Aston Claude,Aston Claude,They are only cousins a novel,They are only cousins : a novel,,,They are only cousins
1146,SC1290,1855,1855,Carter Robert S,Carter Robert S,Talbot Hall a novel,Talbot Hall : a novel,,,Talbot Hall
1147,SC1291,1855,1855,"Elton, John","Elton, John",Edith Vernon or Contrasts of character,"Edith Vernon, or, Contrasts of character",,,Edith Vernon
1149,SC1293,1855,1855,"Gaskell, Elizabeth Cleghorn","Gaskell, Elizabeth Cleghorn",North And South By The Author of Mary Barton In Two Volumes Second Edition,"North And South. By The Author of ""Mary Barton,"" ... In Two Volumes. Second Edition",Industrial,"Allison, Sarah, Ryan Heuser, Matthew Jockers, Franco Moretti, Michael Witmore. ""Quantitative Formalism: an Experiment."" Stanford: Stanford Literary Lab, 2011. Print. | Sutherland, John. The Longman Companion to Victorian Fiction. 2nd ed. Harlow, England: Pearson Longman, 2009.",North And South
1150,SC1294,1855,1855,Goodrich A M,"Goodrich, A M",Gwen or The cousins,"Gwen, or, The cousins",,,Gwen
1151,SC1295,1855,1855,Kingsley Charles 1819 1875,"Kingsley, Charles",Westward ho or The voyages and adventures of Sir Amyas Leigh knight of Burrough in the county of Devon in the reign of Her Most Glorious Majesty Queen Elizabeth,"Westward ho! : or, The voyages and adventures of Sir Amyas Leigh, knight, of Burrough, in the county of Devon, in the reign of Her Most Glorious Majesty Queen Elizabeth",Historical,"Orel, Harold. The Historical Novel from Scott to Sabatini. New York: St. Martin's Press, Inc., 1995.",Westward ho!
1152,SC1296,1855,1855,Lennox William Pitt Lord 1799 1881,"Lennox, Lord William Pitt",Philip Courtenay or Scenes at home and abroad,"Philip Courtenay, or, Scenes at home and abroad",,,Philip Courtenay
1153,SC1297,1855,1855,"Maberly, Mrs. Catherine Charlotte","Maberly, Mrs. Catherine Charlotte",Display a novel,Display : a novel,,,Display
1154,SC1298,1855,1855,Marsh Caldwell Anne 1791 1874,"Marsh, Caldwell Anne",The heiress of Haughton or The mother s secret,"The heiress of Haughton; or, The mother's secret",,,The heiress of Haughton
1155,SC1299,1855,1855,Oliphant Mrs Margaret 1828 1897,"Oliphant, Mrs. Margaret",Lilliesleaf being a concluding series of Passages in the life of Mrs Margaret Maitland of Sunnyside,"Lilliesleaf: being a concluding series of Passages in the life of Mrs. Margaret Maitland, of Sunnyside",,,Lilliesleaf
1156,SC1300,1855,1855,Rafter Captain,Rafter Captain,Percy Blake or The young rifleman,"Percy Blake; or, The young rifleman",,,Percy Blake
1157,SC1301,1855,1855,"Sewell, Elizabeth Missing","Sewell, Elizabeth Missing",Cleve Hall,Cleve Hall,,,Cleve Hall
1158,SC1302,1855,1855,"Sinclair, Catherine","Sinclair, Catherine",Cross purposes a novel,Cross purposes : a novel,,,Cross purposes
1159,SC1303,1855,1855,Stretton Julia Cecilia,Stretton Julia Cecilia,Woman s devotion a novel,Woman's devotion : a novel,,,Woman's devotion
1160,SC1304,1855,1855,"Trollope, Anthony","Trollope, Anthony",The Warden By Anthony Trollope,The Warden. By Anthony Trollope,,,The Warden
1161,SC1306,1855,1855,Wheeler James Talboys 1824 1897,Wheeler James Talboys,The life and travels of Herodotus in the fifth century before Christ an imaginary biography founded on fact illustrative of the history manners religion literature arts and social condition of the Greeks Egyptians Persians Babylonians Hebrews Scythia,"The life and travels of Herodotus in the fifth century : before Christ: an imaginary biography founded on fact, illustrative of the history, manners, religion, literature, arts, and social condition of the Greeks, Egyptians, Persians, Babylonians, He",,,The life and travels of Herodotus in the fifth century
1162,SC1307,1855,1855,Whyte Melville G J George John 1821 1878,"Whyte, Melville George John",General Bounce or The lady and the locusts,"General Bounce : or, The lady and the locusts",,,General Bounce
1163,SC1308,1855,1855,Williams F Miss,Williams F Miss,The secret marriage or Contrasts in life,"The secret marriage, or, Contrasts in life",,,The secret marriage
1164,SC1309,1856,1856,"Armstrong, Francis Claudius","Armstrong, Francis Claudius",The young commander A novel,The young commander : A novel,,,The young commander
1165,SC1310,1856,1856,"Collins, Wilkie","Collins, Wilkie",After dark,After dark,,,After dark
1166,SC1311,1856,1856,East Wilfrid,East Wilfrid,Maurice Elvington or One out of suits with fortune An autobiography,"Maurice Elvington; or, One out of suits with fortune. An autobiography",,,Maurice Elvington
1167,SC1312,1856,1856,Gore Mrs Catherine Grace Frances 1799 1861,"Gore, Mrs. (Catherine Grace Frances)",A life s lessons,A life's lessons,,,A life's lessons
1168,SC1313,1856,1856,James G P R George Payne Rainsford 1801 1860,"James, George Payne Rainsford",The Old Dominion a novel,The Old Dominion : a novel,,,The Old Dominion
1169,SC1315,1856,1856,"Lyle, Max","Lyle, Max","Fair oaks, or, The experiences of Arnold Osborne, M.D","Fair oaks, or, The experiences of Arnold Osborne, M.D",,,Fair oaks
1170,SC1317,1856,1856,"Marsh, Caldwell Anne","Marsh, Caldwell Anne",Evelyn Marston,Evelyn Marston,,,Evelyn Marston
1171,SC1318,1856,1856,Melville Julia,Melville Julia,Old memories a novel,Old memories : a novel,,,Old memories
1172,SC1319,1856,1856,Oliphant Mrs 1828 1897,"Oliphant, Mrs. Margaret",Zaidee a romance,Zaidee : a romance,,,Zaidee
1173,SC1320,1856,1856,Ponsonby Emily Lady 1817 1877,"Ponsonby, Lady Emily",The young Lord,The young Lord,,,The young Lord
1174,SC1321,1856,1856,"Reynolds, George William MacArthur","Reynolds, George W. M. (George William MacArthur)",Ellen Percy or The memoirs of an actress,"Ellen Percy; or, The memoirs of an actress",,,Ellen Percy
1175,SC1322,1856,1856,Scott Lady Caroline Lucy 1784 1857,"Scott, Lady (Caroline Lucy)",The old grey church,The old grey church,,,The old grey church
1176,SC1323,1856,1856,St John James Augustus 1801 1875,St. John James Augustus,The ring and the veil a novel,The ring and the veil : a novel,,,The ring and the veil
1177,SC1324,1856,1856,Stretton Julia Cecilia 1812 1878,Stretton Julia Cecilia,Margaret and her bridesmaids,Margaret and her bridesmaids,,,Margaret and her bridesmaids
1178,SC1325,1856,1856,"Thackeray, William Makepeace","Thackeray, William Makepeace",Doctor Birch and his young friends by Wm M Thackeray,Doctor Birch and his young friends / by Wm. M. Thackeray.,,,Doctor Birch and his young friends
1179,SC1326,1856,1856,"Thackeray, William Makepeace","Thackeray, William Makepeace",The Memoirs of Barry Lyndon Esq of the Kingdom of Ireland By W M Thackeray etc,"The Memoirs of Barry Lyndon, Esq., of the Kingdom of Ireland ... By W. M. Thackeray [etc.]",,,"The Memoirs of Barry Lyndon, Esq"
1180,SC1328,1856,1856,"Wallace, Ellen","Wallace, Ellen",Beyminstre,Beyminstre,,,Beyminstre
1181,SC1329,1856,1856,"Yonge, Charlotte Mary","Yonge, Charlotte Mary",The Daisy Chain or Aspirations A Family Chronicle By the author of The Heir of Redclyffe etc,"The Daisy Chain; or, Aspirations. A Family Chronicle. By the author of The Heir of Redclyffe, etc.",,,The Daisy Chain
1182,SC1330,1857,1857,"Aikin, Kortright Fanny","Aikin, Kortright Fanny","Anne Sherwood: or, The social institutions of England","Anne Sherwood: or, The social institutions of England",,,Anne Sherwood
1183,SC1331,1857,1857,Anonymous,Anonymous,"Brimelsea; or, Character the index of fate","Brimelsea; or, Character the index of fate",,,Brimelsea
1184,SC1332,1857,1857,"Briscoe, Mrs","Briscoe, Mrs",The young bride A novel By Mrs Briscoe In three volumes,The young bride. A novel. : By Mrs. Briscoe. In three volumes,,,The young bride
1186,SC1334,1857,1857,"Bronte, Charlotte","Bronte, Charlotte",The Professor A Tale By Currer Bell Author of Jane Eyre In Two Volumes,"The Professor, A Tale. By Currer Bell, Author of ""Jane Eyre,"" ... In Two Volumes",Bildungsroman,"Allison, Sarah, Ryan Heuser, Matthew Jockers, Franco Moretti, Michael Witmore. ""Quantitative Formalism: an Experiment."" Stanford: Stanford Literary Lab, 2011. Print.",The Professor
1187,SC1335,1857,1857,Chalcraft Harriette Amiel,Chalcraft Harriette Amiel,Lucy Aylmer,Lucy Aylmer,,,Lucy Aylmer
1188,SC1336,1857,1857,Chatterton Georgiana Lady 1806 1876,"Chatterton, Lady Georgiana",Life and its realities,Life and its realities,,,Life and its realities
1189,SC1337,1857,1857,"Collins, Wilkie","Collins, Wilkie",The dead secret,The dead secret,,,The dead secret
1190,SC1338,1857,1857,Cornish Miss,Cornish Miss,Northwode priory,Northwode priory,,,Northwode priory
1191,SC1339,1857,1857,Craik Dinah Maria Mulock 1826 1887,"Craik, Dinah Maria Mulock",Nothing new Tales,Nothing new. Tales,,,Nothing new
1192,SC1340,1857,1857,Craik Georgiana M Georgiana Marion 1831 1895,"Craik, Georgiana Marion",Riverston,Riverston,,,Riverston
1193,SC1341,1857,1857,"Crawford, Mrs. A.","Crawford, Mrs. A.",Early struggles,Early struggles,,,Early struggles
1194,SC1342,1857,1857,Delorme Charles,Delorme Charles,The pedlar A tale of emigration,The pedlar. A tale of emigration ..,,,The pedlar
1195,SC1343,1857,1857,"Dickens, Charles","Dickens, Charles",Little Dorrit By Charles Dickens With Illustrations by H K Browne,Little Dorrit. By Charles Dickens. With Illustrations by H. K. Browne,,,Little Dorrit
1196,SC1344,1857,1857,"Elton, Sir Arthur Hallam","Elton, Arthur Hallam",Below the surface a story of English country life,Below the surface : a story of English country life,,,Below the surface
1197,SC1345,1857,1857,Goodrich A M,"Goodrich, A M",The myrtle and the heather a tale,The myrtle and the heather : a tale,,,The myrtle and the heather
1198,SC1346,1857,1857,Gore Mrs Catherine Grace Frances 1799 1861,"Gore, Mrs. (Catherine Grace Frances)",The two aristocracies a novel,The two aristocracies : a novel,,,The two aristocracies
1199,SC1347,1857,1857,Grogan Mercy Mrs,"Grogan, Mercy Mrs",The Roua pass or Englishmen in the highlands,"The Roua pass ; or, Englishmen in the highlands",,,The Roua pass
1200,SC1348,1857,1857,Hemphill Barbara d 1858,"Hemphill, Barbara Hare",Freida the Jongleur,Freida the Jongleur.,,,Freida the Jongleur
1201,SC1349,1857,1857,Horlock Knightley William 1802 1882,"Horlock, Knightley William",The Squire of Beechwood a true tale of Scrutator pseud,"The Squire of Beechwood, a true tale of Scrutator [pseud.]",,,The Squire of Beechwood
1202,SC1350,1857,1857,"Hughes, Thomas","Hughes, Thomas",Tom Brown s School Days By an Old Boy,Tom Brown's School Days. By an Old Boy,School Story,"Hunt, Peter. ""Children's Novels."" Encyclopedia of the Novel. Eds. Paul Schellinger, Christopher Hudson, and Marijke Rijsberman. Chicago: Fitzroy Dearborn Publishers, 1998.",Tom Brown's School Days
1203,SC1351,1857,1857,James G P R George Payne Rainsford 1801 1860,"James, George Payne Rainsford",Leonora d Orco a historical romance,Leonora d'Orco : a historical romance ...,Historical,title inference,Leonora d'Orco
1204,SC1353,1857,1857,Liddell Charles Francis,Liddell Charles Francis,Hidden links or The schoolfellows a tale,"Hidden links, or, The schoolfellows : a tale",,,Hidden links
1205,SC1354,1857,1857,Marsh Caldwell Anne 1791 1874,"Marsh, Caldwell Anne",The rose of Ashurst,The rose of Ashurst,,,The rose of Ashurst
1206,SC1355,1857,1857,Melville Julia,Melville Julia,The Gables a story of a life in three volumes,"The Gables : a story of a life, in three volumes",,,The Gables
1207,SC1356,1857,1857,Morier David R David Richard 1784 1877,Morier David Richard,Photo the Suliote a tale of modern Greece,Photo the Suliote : a tale of modern Greece,,,Photo the Suliote
1208,SC1357,1857,1857,Murray Charles Augustus Sir 1806 1895,Murray Charles Augustus,Hassan or The child of the pyramid An Egyptian tale,"Hassan : or, The child of the pyramid. An Egyptian tale",,,Hassan
1209,SC1358,1857,1857,"Oliphant, Mrs. Margaret","Oliphant, Mrs. Margaret",The Athelings or The three gifts,"The Athelings, or, The three gifts",,,The Athelings
1210,SC1359,1857,1857,"Oliphant, Mrs. Margaret","Oliphant, Mrs. Margaret",The days of my life An autobiography,The days of my life. An autobiography,,,The days of my life
1211,SC1360,1857,1857,Paull Margaret Agnes,Paull Margaret Agnes,Still waters,Still waters,,,Still waters
1212,SC1361,1857,1857,Reade Charles 1814 1884,"Reade, Charles",White lies a story,White lies : a story,,,White lies
1213,SC1362,1857,1857,"Reynolds, George W. M. (George William MacArthur)","Reynolds, George W. M. (George William MacArthur)","Agnes, or, Beauty and Pleasure","Agnes, or, Beauty and pleasure ...",,,Agnes
1214,SC1364,1857,1857,Rowcroft Albert E,Rowcroft Albert E,Philip Darrell a romance of English home life,Philip Darrell : a romance of English home life,,,Philip Darrell
1215,SC1365,1857,1857,St John Vane Ireton,St John Vane Ireton,St Eustace or The hundred and one a novel in three volumes,"St. Eustace : or, The hundred-and-one : a novel in three volumes",,,St Eustace
1216,SC1366,1857,1857,Thomas of Swarraton,Thomas of Swarraton,The noble traytour a chronicle,The noble traytour : a chronicle,,,The noble traytour
1217,SC1367,1857,1857,"Trollope, Anthony","Trollope, Anthony",Barchester Towers By Anthony Trollope In Three Volumes,Barchester Towers. By Anthony Trollope ... In Three Volumes,,,Barchester Towers
1218,SC1368,1857,1857,"Trollope, Frances Milton","Trollope, Frances Milton",The widow Barnaby by Frances Trollope,The widow Barnaby / by Frances Trollope.,,,The widow Barnaby
1219,SC1370,1857,1857,Williams F Miss,Williams F Miss,Seymour and his friends a novel,Seymour and his friends; a novel,,,Seymour and his friends
1220,SC1371,1857,1857,"Yonge, Charlotte Mary","Yonge, Charlotte Mary",Dynevor Terrace or The clue of life,"Dynevor Terrace; or, The clue of life",,,Dynevor Terrace
1221,SC1372,1858,1858,Anonymous,Anonymous,Eva Desmond or Mutation,"Eva Desmond, or, Mutation",,,Eva Desmond
1222,SC1373,1858,1858,"Ballantyne, (R. M.)","Ballantyne, (R. M.)",The Coral Island A Tale of the Pacific Ocean By Robert Michael Ballantyne With Illustrations by the Author,The Coral Island: A Tale of the Pacific Ocean. By Robert Michael Ballantyne ... With Illustrations by the Author,,,The Coral Island
1223,SC1374,1858,1858,"Bunbury, Selina","Bunbury, Selina",Sir Guy d Esterre,Sir Guy d'Esterre,,,Sir Guy d'Esterre
1224,SC1375,1858,1858,Caddell Cecilia Mary d 1877,Caddell Cecilia Mary,Home the homeless A novel By Cecilia Mary Caddell In three volumes,"Home & the homeless : A novel. By Cecilia Mary Caddell, ... In three volumes",,,Home & the homeless
1225,SC1376,1858,1858,Chatterton Georgiana Lady 1806 1876,"Chatterton, Lady Georgiana",The reigning beauty,The reigning beauty,,,The reigning beauty
1226,SC1377,1858,1858,Coke Henry J Henry John 1827 1916,Coke Henry John,A will and a way,A will and a way,,,A will and a way
1227,SC1378,1858,1858,Day Julia,Day Julia,The Gilberts their guests a story of homely English life,The Gilberts & their guests : a story of homely English life,,,The Gilberts & their guests
1228,SC1379,1858,1858,East Timothy,East Timothy,The sheepfold and the common or Within and without,"The sheepfold and the common, or, Within and without",,,The sheepfold and the common
1229,SC1380,1858,1858,"Eliot, George","Eliot, George",Scenes of Clerical Life By George Eliot In Two Volumes,Scenes of Clerical Life: By George Eliot: In Two Volumes,,,Scenes of Clerical Life
1230,SC1381,1858,1858,Ellis Sarah Stickney 1812 1872,Ellis Sarah Stickney,Friends at their own fireside or pictures of the private life of the people called Quakers,"Friends at their own fireside : or, pictures of the private life of the people called Quakers",,,Friends at their own fireside
1231,SC1382,1858,1858,"Farrar, F. W. (Frederic William)","Farrar, F. W. (Frederic William)",Eric or Little by Little A Tale of Roslyn School By Frederic W Farrar,"Eric: or, Little by Little: A Tale of Roslyn School. By Frederic W. Farrar",School Story,"Hunt, Peter. ""Children's Novels."" Encyclopedia of the Novel. Eds. Paul Schellinger, Christopher Hudson, and Marijke Rijsberman. Chicago: Fitzroy Dearborn Publishers, 1998.",Eric
1232,SC1383,1858,1858,"Fullerton, Lady Georgiana Lady","Fullerton, Lady Georgiana",The countess de Bonneval her life and letters,The countess de Bonneval: her life and letters,,,The countess de Bonneval
1233,SC1384,1858,1858,"Hopton, Anna Maria","Hopton, Anna Maria",Dawn and twilight a tale,Dawn and twilight : a tale,,,Dawn and twilight
1234,SC1385,1858,1858,James G P R George Payne Rainsford 1801 1860,"James, George Payne Rainsford",Lord Montagu s page a historical romance,Lord Montagu's page : a historical romance,Historical,title inference,Lord Montagu's page
1235,SC1386,1858,1858,Lavenu L S,Lavenu L S,Gaston Bligh,Gaston Bligh,,,Gaston Bligh
1236,SC1389,1858,1858,Manning Anne 1807 1879,"Manning, Anne",The ladies of Bever Hollow a tale of English country life,The ladies of Bever Hollow : a tale of English country life,,,The ladies of Bever Hollow
1237,SC1390,1858,1858,Oliphant Mrs Margaret 1828 1897,"Oliphant, Mrs. Margaret",The laird of Norlaw a Scottish story,The laird of Norlaw : a Scottish story,,,The laird of Norlaw
1238,SC1392,1858,1858,Ponsonby Emily Lady 1817 1877,"Ponsonby, Lady Emily",The two brothers,The two brothers,,,The two brothers
1239,SC1393,1858,1858,Sewell Elizabeth Missing 1815 1906,"Sewell, Elizabeth Missing",Ursula a tale of country life,Ursula : a tale of country life,,,Ursula
1240,SC1394,1858,1858,Sheppard Elizabeth Sara 1830 1862,"Sheppard, Elizabeth Sara",Rumour,Rumour,,,Rumour
1241,SC1395,1858,1858,"Thackeray, William Makepeace","Thackeray, William Makepeace",The Virginians A Tale of the Last Century By W M Thackeray With Illustrations on Steel and Wood by the Author,The Virginians. A Tale of the Last Century. By W. M. Thackeray ... With Illustrations on Steel and Wood by the Author,Historical,"Orel, Harold. The Historical Novel from Scott to Sabatini. New York: St. Martin's Press, Inc., 1995.",The Virginians
1242,SC1396,1858,1858,"Trollope, Anthony","Trollope, Anthony",Doctor Thorne A Novel By Anthony Trollope In Three Volumes,Doctor Thorne. A Novel. By Anthony Trollope ... In Three Volumes,,,Doctor Thorne
1243,SC1397,1858,1858,"Trollope, Anthony","Trollope, Anthony",The Three Clerks A Novel By Anthony Trollope In Three Volumes,The Three Clerks. A Novel. By Anthony Trollope ... In Three Volumes,,,The Three Clerks
1244,SC1398,1858,1858,Tupper Martin Farquhar 1810 1889,Tupper Martin Farquhar,Stephan Langton,Stephan Langton,,,Stephan Langton
1245,SC1399,1858,1858,Wilbraham Frances M,Wilbraham Frances M,For and against or Queen Margaret s badge a domestic chronicle of the fifteenth century,"For and against : or, Queen Margaret's badge : a domestic chronicle of the fifteenth century",,,For and against
1246,SC1400,1859,1859,Anonymous,Anonymous,Aggesden vicarage : or Bridget Storey's first charge. A tale for the young. In two volumes,Aggesden vicarage : or Bridget Storey's first charge. A tale for the young. In two volumes,,,Aggesden vicarage
1247,SC1401,1859,1859,"Barrowcliffe, A J","Barrowcliffe, A J",Trust for trust,Trust for trust,,,Trust for trust
1248,SC1402,1859,1859,Chorley Henry Fothergill 1808 1872,Chorley Henry Fothergill,Roccabella a tale of a woman s life,Roccabella : a tale of a woman's life,,,Roccabella
1249,SC1403,1859,1859,Collins Wilkie 1824 1889,"Collins, Wilkie",The Queen of Hearts,The Queen of Hearts,,,The Queen of Hearts
1251,SC1426,1860,1859,Collins Wilkie 1824 1889,"Collins, Wilkie",The woman in white,The Woman in White. By Wilkie Collins ... In Three Volumes. New Edition,Sensation,"Allison, Sarah, Ryan Heuser, Matthew Jockers, Franco Moretti, Michael Witmore. ""Quantitative Formalism: an Experiment."" Stanford: Stanford Literary Lab, 2011. Print.",The Woman in White
