,id_orig,year_orig,year,author_orig,author,title_orig,title,genre,source,title_short
473,SC0547,1823,1823,"Galt, John","Galt, John",The Entail or The Lairds Of Grippy By The Author Of Annals Of The Parish c In Three Volumes,The Entail: or The Lairds Of Grippy. By The Author Of Annals Of The Parish ... &c. In Three Volumes.,Historical | National,"Allison, Sarah, Ryan Heuser, Matthew Jockers, Franco Moretti, Michael Witmore. ""Quantitative Formalism: an Experiment."" Stanford: Stanford Literary Lab, 2011. Print. | Trumpener, Katie. ""National Character, Nationalist Plots: National Tale and Historical Novel in the Age of Waverley, 1806-1830."" Bardic Nationalism. New Jersey: Princeton University Press, 1997.",The Entail
474,SC0548,1823,1823,Gaspey Thomas 1788 1871,"Gaspey, Thomas",Other times or the monks of Leadenhall,"Other times; or, the monks of Leadenhall",Gothic,Literary Lab Corpus I,Other times
475,SC0549,1823,1823,Grattan Thomas Colley 1792 1864,"Grattan, Thomas Colley",High ways and by ways or Tales of the roadside picked up in the French provinces,"High-ways and by-ways; or, Tales of the roadside, picked up in the French provinces",,,High-ways and by-ways
476,SC0551,1823,1823,Kennedy Grace 1782 1825,"Kennedy, Grace",Willoughby or Reformation the influence of religious principles,"Willoughby; or, Reformation; the influence of religious principles..",,,Willoughby
477,SC0552,1823,1823,"Kennedy, Grace","Kennedy, Grace",Father Clement a Roman Catholic story by the author of The decision Profession is not principle c,"Father Clement : a Roman Catholic story / by the author of ""The decision,"" ""Profession is not principle,"" &c.",,,Father Clement
478,SC0553,1823,1823,"Lamb, Lady Caroline","Lamb, Lady Caroline",Ada Reis: a tale,Ada Reis : a tale,Silver Fork|Gothic,"Adburgham, Alison. ""Bibliographies, Silver Fork Novels"". Silver Fork Society : Fashionable Life and Literature From 1814 to 1840. London: Constable, 1983. 320-332.|Literary Lab Corpus I",Ada Reis
479,SC0554,1823,1823,Lockhart J G John Gibson 1794 1854,Lockhart John Gibson,Reginald Dalton,Reginald Dalton,,,Reginald Dalton
480,SC0555,1823,1823,Meeke Mary Mrs,Meeke Mary,What shall be shall be in four volumes,"What shall be, shall be: in four volumes",,,"What shall be, shall be"
481,SC0556,1823,1823,Moore Clara,Moore Clara,Isabella A novel,Isabella. A novel,,,Isabella
483,SC1443,1860,1860,"Scott, Walter, Sir","Scott, Walter",Peveril of the Peak,Peveril of the Peak.,Historical,"Sutherland, John. The Longman Companion to Victorian Fiction. 2nd ed. Harlow, England: Pearson Longman, 2009.",Peveril of the Peak
484,SC0560,1823,1823,"Scott, Walter, Sir","Scott, Walter",Quentin Durward in the Waverley Novels,"Quentin Durward [in, the Waverley Novels]",Historical,"Allison, Sarah, Ryan Heuser, Matthew Jockers, Franco Moretti, Michael Witmore. ""Quantitative Formalism: an Experiment."" Stanford: Stanford Literary Lab, 2011. Print. | Sutherland, John. The Longman Companion to Victorian Fiction. 2nd ed. Harlow, England: Pearson Longman, 2009.",Quentin Durward
486,SC0575,1824,1823,Scott Walter Sir 1771 1832,"Scott, Walter",St Ronan s well,"St. Ronan's Well [in, the Waverley Novels]",Historical,"Allison, Sarah, Ryan Heuser, Matthew Jockers, Franco Moretti, Michael Witmore. ""Quantitative Formalism: an Experiment."" Stanford: Stanford Literary Lab, 2011. Print. | Sutherland, John. The Longman Companion to Victorian Fiction. 2nd ed. Harlow, England: Pearson Longman, 2009.",St Ronan's Well
487,SC0562,1823,1823,"Shelley, Mary Wollstonecraft","Shelley, Mary Wollstonecraft",Valperga Or the Life and Adventures of Castruccio Prince of Lucca By the Author of Frankenstein In Three Volumes,"Valperga: Or the Life and Adventures of Castruccio, Prince of Lucca. By the Author of ""Frankenstein."" In Three Volumes.",Historical|Gothic,"Allison, Sarah, Ryan Heuser, Matthew Jockers, Franco Moretti, Michael Witmore. ""Quantitative Formalism: an Experiment."" Stanford: Stanford Literary Lab, 2011. Print.|Literary Lab Corpus I",Valperga
488,SC0563,1823,1823,Sullivan Mary Ann,Sullivan Mary Ann,Owen Castle or Which is the heroine A novel,"Owen Castle, or, Which is the heroine? A novel",Gothic,Literary Lab Corpus I,Owen Castle
489,SC0564,1823,1823,Sutherland Alexander Lieutenant,Sutherland Alexander Lieutenant,Macrimmon A Highland tale,Macrimmon. A Highland tale,,,Macrimmon
490,SC0565,1824,1824,An Unknown,An Unknown,"aprice; or, Anecdotes of the Listowel family","Caprice; or, Anecdotes of the Listowel family. An Irish novel",,,Caprice
491,SC0566,1824,1824,Dillon Henry Augustus Dillon Lee Viscount 1777 1832,Dillon Henry Augustus Dillon Lee,Rosaline de Vere,Rosaline de Vere,,,Rosaline de Vere
492,SC0567,1824,1824,Gaspey Thomas 1788 1871,"Gaspey, Thomas",The witch finder a romance,The witch-finder : a romance,,,The witch-finder
493,SC0568,1824,1824,"Hogg, James","Hogg, James",The Private Memoirs And Confessions Of A Justified Sinner Written by himself with a detail of curious traditionary facts and other evidence by the editor,"The Private Memoirs And Confessions Of A Justified Sinner: Written by himself: with a detail of curious traditionary facts and other evidence, by the editor",,,The Private Memoirs And Confessions Of A Justified Sinner
494,SC0569,1824,1824,Hook Theodore Edward 1788 1841,"Hook, Theodore Edward",Sayings and doings A series of sketches from life First series,Sayings and doings. A series of sketches from life [First series],Silver Fork,"Adburgham, Alison. Bibliographies, Silver Fork Novels. Silver Fork Society : Fashionable Life and Literature From 1814 to 1840. London: Constable, 1983. 320-332.|Literary Lab Corpus I",Sayings and doings
495,SC0570,1824,1824,Kelty Mary A,Kelty Mary Ann,Trials,Trials,,,Trials
496,SC0571,1824,1824,M Donogh Felix 1768 1836,M'Donogh Felix,The highlanders a tale,The highlanders : a tale,,,The highlanders
497,SC0572,1824,1824,Moore Margaret King 1772 1835,Moore Margaret King,The sisters of Nansfield A tale for young women,The sisters of Nansfield. A tale for young women,,,The sisters of Nansfield
498,SC0573,1824,1824,"Morier, James Justinian","Morier, James Justinian",The adventures of Hajji Baba of Ispahan,"The adventures of Hajji Baba, of Ispahan",,,"The adventures of Hajji Baba, of Ispahan"
499,SC0574,1824,1824,Roche Regina Maria 1764 1845,Regina Maria Roche,The tradition of the castle or Scenes in the Emerald Isle,"The tradition of the castle; or, Scenes in the Emerald Isle ..",National,"Trumpener, Katie. ""National Tale."" Encyclopedia of the Novel. Eds. Paul Schellinger, Christopher Hudson, and Marijke Rijsberman. Chicago: Fitzroy Dearborn Publishers, 1998.",The tradition of the castle
500,SC0576,1824,1824,"Scott, Walter, Sir","Scott, Walter",Redgauntlet in the Waverley Novels,"Redgauntlet [in, the Waverley Novels]",Historical,"Allison, Sarah, Ryan Heuser, Matthew Jockers, Franco Moretti, Michael Witmore. ""Quantitative Formalism: an Experiment."" Stanford: Stanford Literary Lab, 2011. Print. | Sutherland, John. The Longman Companion to Victorian Fiction. 2nd ed. Harlow, England: Pearson Longman, 2009.",Redgauntlet
501,SC0578,1824,1824,Ward Catherine G 1787,Ward Catherine George,The fisher s daughter or The wanderings of Wolf and the fortunes of Alfred,"The fisher's daughter, or, The wanderings of Wolf and the fortunes of Alfred",,,The fisher's daughter
502,SC0579,1825,1825,Anonymous,Anonymous,"The Adventurers; Or, Scenes in Ireland, in the Reign of Elizabeth","The adventurers : or, Scenes in Ireland, in the reign of Elizabeth",,,The adventurers
503,SC0580,1825,1825,"Bedford, John Harman","Bedford, John Harman",Wanderings of Childe Harolde a romance of real life interspersed with memoirs of the English wife the foreign mistress and various other celebrated characters,"Wanderings of Childe Harolde : a romance of real life : interspersed with memoirs of the English wife, the foreign mistress, and various other celebrated characters",,,Wanderings of Childe Harolde
504,SC0582,1825,1825,"Coxe, Frances Clare Adeline","Coxe, Frances Clare Adeline","The Camisard, or, The Protestants of Languedoc","The Camisard, or, The Protestants of Languedoc : a tale",,,The Camisard
505,SC0583,1825,1825,De Quincey Thomas 1785 1859,De Quincey Thomas,Walladmor,Walladmor,,,Walladmor
506,SC0584,1825,1825,"Denniston, James","Denniston, James",Legends of Galloway being a series of traditions illustrative of its ancient history customs manners and superstititions,"Legends of Galloway; being a series of traditions, illustrative of its ancient history, customs, manners, and superstititions.",,,Legends of Galloway
507,SC0585,1825,1825,Harding Anne Raikes 1780 1858,"Harding, Anne Raikes",Realities not a novel a tale from real life,"Realities / not a novel, a tale from real life",,,Realities
508,SC0586,1825,1825,"Hartstonge, Matthew Weld","Hartstonge, Matthew Weld",The eve of All Hallows or Adelaide of Tyrconnel a romance,"The eve of All-Hallows; or, Adelaide of Tyrconnel; a romance ..",,,The eve of All-Hallows
509,SC0587,1825,1825,Helme Elizabeth d 1814,"Helme, Elizabeth",The farmer of Inglewood Forest or An affecting portrait of virtue and vice,"The farmer of Inglewood Forest ; or, An affecting portrait of virtue and vice",Anti-Jacobin,Literary Lab Corpus I,The farmer of Inglewood Forest
511,SC0653,1828,1828,Hook Theodore Edward 1788 1841,"Hook, Theodore Edward",Sayings and doings or Sketches from life Third series In three volumes,"Sayings and doings, or, Sketches from life. Third series. In three volumes.",Silver Fork,"Adburgham, Alison. Bibliographies, Silver Fork Novels. Silver Fork Society : Fashionable Life and Literature From 1814 to 1840. London: Constable, 1983. 320-332.|Literary Lab Corpus I",Sayings and doings
512,SC0589,1825,1825,"Kennedy, Grace","Kennedy, Grace",Dunallan or Know what you judge a story,"Dunallan : or, Know what you judge : a story",,,Dunallan
513,SC0590,1825,1825,Lauder Thomas Dick Sir 1784 1848,Lauder Thomas Dick,Lochandhu a tale of the eighteenth century,Lochandhu : a tale of the eighteenth century,,,Lochandhu
514,SC0591,1825,1825,"Lewis, M. G. Miss","Lewis, M. G. Miss",Ambition,Ambition,,,Ambition
515,SC0592,1825,1825,Maxwell W H William Hamilton 1792 1850,Maxwell William Hamilton (W.H.),O Hara,O'Hara;,,,O'Hara
516,SC0593,1825,1825,Ogle Nathaniel,Ogle Nathaniel,Mariamne an historical novel of Palestine,Mariamne : an historical novel of Palestine,Historical,title inference,Mariamne
517,SC0594,1825,1825,Pyne W H William Henry 1769 1843,Pyne William Henry,The twenty ninth of May rare doings at the restoration,The twenty-ninth of May: rare doings at the restoration,,,The twenty-ninth of May
518,SC0595,1825,1825,S l J n Esq,S l J n Esq,Husband hunting or The mother and daughters a tale of fashionable life,"Husband hunting, or, The mother and daughters : a tale of fashionable life",,,Husband hunting
519,SC0596,1825,1825,Sherer Moyle 1789 1869,"Sherer, Moyle",The story of a life,The story of a life,,,The story of a life
520,SC0597,1825,1825,Sherwood Mrs Mary Martha 1775 1851,Sherwood Mary Martha,The lady of the manor being a series of conversations on the subject of confirmation intended for the use of middle and higher ranks of young females,The lady of the manor : being a series of conversations on the subject of confirmation intended for the use of middle and higher ranks of young females,,,The lady of the manor
521,SC0598,1825,1825,Slingsby Henry,Slingsby Henry,My grandmother s guests and their tales,My grandmother's guests and their tales,,,My grandmother's guests and their tales
522,SC0601,1825,1825,"Wallace, Robert Grenville","Wallace, Robert Grenville",Forty years in the world or Sketches and tales of a soldier s life By the author of Fifteen years in India Memoirs of India c c c,"Forty years in the world; or, Sketches and tales of a soldier's life. By the author of ""Fifteen years in India,"" ""Memoirs of India,"" &c.&c.&c.",,,Forty years in the world
524,SC0637,1827,1825,Ward R Plumer Robert Plumer 1765 1846,Ward Robert Plumer,Tremanine or The man of refinement,"Tremaine : or, The man of refinement",Silver Fork,"Adburgham, Alison. ""Bibliographies, Silver Fork Novels"". Silver Fork Society : Fashionable Life and Literature From 1814 to 1840. London: Constable, 1983. 320-332.|Literary Lab Corpus I",Tremaine
525,SC0603,1826,1826,Anonymous,Anonymous,Eustace Fitz Richard A tale of the Barons wars,Eustace Fitz-Richard. A tale of the Barons' wars,Gothic,Literary Lab Corpus I,Eustace Fitz-Richard
526,SC0604,1826,1826,"Battersby, John","Battersby, John",Tell tale Sophas an eclectic fable founded on anecdotes foreign and domestic,"Tell-tale Sophas : an eclectic fable : founded on anecdotes, foreign and domestic",,,Tell-tale Sophas
527,SC0605,1826,1826,"Bray, Anna Eliza","Bray, Anna Eliza",De Foix or Sketches of the manners and customs of the fourteenth century An historical romance,"De Foix; or, Sketches of the manners and customs of the fourteenth century. An historical romance",Historical,title inference,De Foix
528,SC0606,1826,1826,Cunningham Allan 1784 1842,Cunningham Allan,Paul Jones a romance,Paul Jones : a romance,,,Paul Jones
530,SC0608,1826,1826,"Disraeli, Benjamin, Earl of Beaconsfield","Disraeli, Benjamin",Vivian Grey A New Edition,Vivian Grey,Silver Fork,"Adburgham, Alison. ""Bibliographies, Silver Fork Novels"". Silver Fork Society : Fashionable Life and Literature From 1814 to 1840. London: Constable, 1983. 320-332.|Literary Lab Corpus I",Vivian Grey
531,SC0609,1826,1826,"Eaton, Charlotte Anne","Eaton, Charlotte Anne",Continental adventures A novel,Continental adventures. A novel ..,,,Continental adventures
532,SC0610,1826,1826,Hockley W B William Browne 1792 1860,"Hockley, William Browne (W. B.)",Pandurang H r or Memoirs of a Hindoo,"Pandurang Hàrì, or Memoirs of a Hindoo ..",,,Pandurang Hàrì
533,SC0611,1826,1826,"Hudson, Marianne Spencer Stanhope","Hudson, Marianne Spencer Stanhope",Almack's: A Novel,Almack's,Silver Fork,"Adburgham, Alison. ""Bibliographies, Silver Fork Novels"". Silver Fork Society : Fashionable Life and Literature From 1814 to 1840. London: Constable, 1983. 320-332.|Literary Lab Corpus I",Almack's
534,SC0612,1826,1826,Kelty Mary Ann 1789 1873,Kelty Mary Ann,The story of Isabel,The story of Isabel;,,,The story of Isabel
536,SC0614,1826,1826,"Lister, T. H. (Thomas Henry)","Lister, T. H. (Thomas Henry)",Granby a novel,"Granby, a novel.",Silver Fork,"Adburgham, Alison. ""Bibliographies, Silver Fork Novels"". Silver Fork Society : Fashionable Life and Literature From 1814 to 1840. London: Constable, 1983. 320-332.|Literary Lab Corpus I",Granby
537,SC0615,1826,1826,"Masson, Andr├⌐","Masson, André",The eccentric traveller,The eccentric traveller ..,,,The eccentric traveller
538,SC0616,1826,1825,Normanby Constantine Henry Phipps Marquess of 1797 1863,Constantine Henry Phipps,Matilda a tale of the day,Matilda : a tale of the day,Silver Fork,"Adburgham, Alison. ""Bibliographies, Silver Fork Novels"". Silver Fork Society : Fashionable Life and Literature From 1814 to 1840. London: Constable, 1983. 320-332.|Literary Lab Corpus I",Matilda
539,SC0617,1826,1826,Porter Anna Maria 1780 1832,"Porter, Anna Maria",Honor O Hara A novel,Honor O'Hara. A novel ..,,,Honor O'Hara
540,SC0618,1826,1826,"Putney, Charlotte","Putney, Charlotte",The Brazen Mask; a Romance,The brazen mask : a romance,,,The brazen mask
541,SC0619,1826,1826,"Radcliffe, Ann Ward","Radcliffe, Ann Ward",Gaston de Blondeville or The court of Henry III keeping festival in Ardenne a romance St Alban s abbey a metrical tale with some poetical pieces,"Gaston de Blondeville, or The court of Henry III. keeping festival in Ardenne, a romance, St. Alban's abbey, a metrical tale; with some poetical pieces",Gothic,Literary Lab Corpus I,Gaston de Blondeville
542,SC0620,1826,1826,Shelley Mary Wollstonecraft 1797 1851,"Shelley, Mary Wollstonecraft",The last man,The Last Man. By the Author of Frankenstein. In Three Volumes,Gothic,Literary Lab Corpus I,The Last Man
543,SC0621,1826,1826,"Shelley, Mary Wollstonecraft","Shelley, Mary Wollstonecraft",The Last Man By the Author of Frankenstein In Three Volumes,The Last Man. By the Author of Frankenstein. In Three Volumes,Gothic,Literary Lab Corpus I,The Last Man
544,SC0622,1826,1826,St Leger Barry 1799 1829,St. Leger Barry,Mr Blount s mss being selections from the papers of a man of the world,Mr. Blount's mss.; being selections from the papers of a man of the world,,,Mr Blount's mss
545,SC0624,1827,1827,"Burdett, C D Mrs","Burdett, C D Mrs",High life a novel,High Life,Silver Fork,"Adburgham, Alison. �Bibliographies, Silver Fork Novels�. Silver Fork Society : Fashionable Life and Literature From 1814 to 1840. London: Constable, 1983. 320-332.",High Life
546,SC0625,1827,1827,C D Golland,C D Golland,The ruins of Ruthvale abbey A Novel,The ruins of Ruthvale abbey: A Novel,Gothic,Literary Lab Corpus I,The ruins of Ruthvale abbey
547,SC0626,1827,1827,Eaton Charlotte A Charlotte Anne 1788 1859,"Eaton, Charlotte Anne",Vittoria Colonna a tale of Rome in the nineteenth century,"Vittoria Colonna: a tale of Rome, in the nineteenth century ..",,,Vittoria Colonna
548,SC0627,1827,1827,Hamilton Thomas 1789 1842,"Hamilton, Thomas",The youth and manhood of Cyril Thornton,The youth and manhood of Cyril Thornton,,,The youth and manhood of Cyril Thornton
549,SC0628,1827,1827,Hood Thomas 1799 1845,"Hood, Thomas",National tales,National tales,,,National tales
550,SC0629,1827,1827,"Johnstone, Christian Isobel","Johnstone, Christian Isobel",Elizabeth de Bruce,Elizabeth de Bruce,,,Elizabeth de Bruce
551,SC0630,1827,1827,Lauder Thomas Dick Sir 1784 1848,Lauder Thomas Dick,The wolfe of Badenoch a historical romance of the fourteenth century,The wolfe of Badenoch : a historical romance of the fourteenth century,Historical,title inference,The wolfe of Badenoch
552,SC0631,1827,1827,Maginn William 1793 1842,Maginn William,The military sketch book Reminiscences of seventeen years in the service abroad and at home,The military sketch-book. Reminiscences of seventeen years in the service abroad and at home,,,The military sketch-book
553,SC0632,1827,1827,Scargill William Pitt 1787 1836,"Scargill, William Pitt",Truckleborough hall a novel,Truckleborough hall; a novel,,,Truckleborough hall
554,SC0633,1827,1827,"Scargill, William Pitt","Scargill, William Pitt",Blue stocking Hall,Blue-stocking Hall,,,Blue-stocking Hall
555,SC0634,1827,1827,"Spence, Elizabeth Isabella","Spence, Elizabeth Isabella",Dame Rebecca Berry or Court scenes in the reign of Charles the Second,"Dame Rebecca Berry; or, Court scenes in the reign of Charles the Second",,,Dame Rebecca Berry
556,SC0638,1827,1827,"Ward, Robert Plumer",Ward Robert Plumer,De Vere or The man of independence,"De Vere; or, The Man of Independence",Silver Fork,"Adburgham, Alison. ""Bibliographies, Silver Fork Novels"". Silver Fork Society : Fashionable Life and Literature From 1814 to 1840. London: Constable, 1983. 320-332.|Literary Lab Corpus I",De Vere
557,SC0639,1827,1827,West Mrs Jane 1758 1852,"West, Mrs. Jane",Ringrove or Old fashioned notions,"Ringrove; or, Old fashioned notions",Gothic,Literary Lab Corpus I,Ringrove
558,SC0640,1827,1827,Willis Hal pseud,Willis Hal pseud,Sir Roland A romance of the twelfth century in four volumes,Sir Roland : A romance of the twelfth century in four volumes,,,Sir Roland
559,SC0641,1827,1827,Woodrooffe Anne,Woodrooffe Anne,Michael the married man,"Michael, the married man",,,"Michael, the married man"
560,SC0642,1828,1828,"Bray, Anna Eliza","Bray, Anna Eliza",The protestant a tale of the reign of Queen Mary,The protestant; a tale of the reign of Queen Mary,,,The protestant
561,SC0643,1828,1828,"Bray, Anna Eliza","Bray, Anna Eliza",The white hoods an historical romance,The white hoods : an historical romance,Historical,title inference,The white hoods
562,SC0644,1828,1828,"Bristow, Amelia","Bristow, Amelia",Emma de Lissau a narrative of striking vicissitudes and peculiar trials with explanatory notes illustrative of the manners and customs of the Jews,"Emma de Lissau : a narrative of striking vicissitudes and peculiar trials : with explanatory notes, illustrative of the manners and customs of the Jews",,,Emma de Lissau
563,SC0645,1828,1828,"Burdett, Mrs. C. D.","Burdett, C D Mrs",At home A novel,At home. A novel,,,At home
564,SC0646,1828,1828,"Carrington, Edmund Frederick John","Carrington, Edmund Frederick John",Confessions of an old maid,Confessions of an old maid,,,Confessions of an old maid
565,SC0647,1828,1828,Corbett M,Corbett M,Tales and legends,Tales and legends,,,Tales and legends
566,SC0648,1828,1828,Croly George 1780 1860,Croly George,Tales of the Great St Bernard,Tales of the Great St. Bernard,,,Tales of the Great St Bernard
567,SC0649,1828,1828,Cunningham Allan 1784 1842,Cunningham Allan,Sir Michael Scott a romance,Sir Michael Scott : a romance,,,Sir Michael Scott
568,SC0650,1828,1828,Gaspey Thomas 1788 1871,"Gaspey, Thomas",History of George Godfrey,History of George Godfrey,,,History of George Godfrey
569,SC0652,1828,1828,"Grey, Mrs. Elizabeth Caroline","Grey, Mrs. Elizabeth Caroline",De Lisle or The sensitive man in three volumes,"De Lisle, or, The sensitive man : in three volumes",,,De Lisle
570,SC0654,1828,1828,Lister T H q Thomas Henry 1800 1842,"Lister, T. H. (Thomas Henry)",Herbert Lacy,Herbert Lacy,Silver Fork,"Adburgham, Alison. ""Bibliographies, Silver Fork Novels"". Silver Fork Society : Fashionable Life and Literature From 1814 to 1840. London: Constable, 1983. 320-332.|Literary Lab Corpus I",Herbert Lacy
571,SC0655,1828,1828,"Lytton, Edward","Lytton, Edward",Pelham Or The Adventures Of A Gentleman Second Edition In Three Volumes,"Pelham; Or, The Adventures Of A Gentleman. Second Edition. In Three Volumes.",Silver Fork,"Allison, Sarah, Ryan Heuser, Matthew Jockers, Franco Moretti, Michael Witmore. ""Quantitative Formalism: an Experiment."" Stanford: Stanford Literary Lab, 2011. Print.|Literary Lab Corpus I",Pelham
572,SC0656,1828,1828,"Porter, Jane","Porter, Jane",Coming Out; and the Field of the Forty Footsteps,Coming out; and The field of the forty footsteps,,,Coming out
573,SC0659,1828,1828,Scargill William Pitt 1787 1836,"Scargill, William Pitt",Penelope or Love s labour lost a novel,"Penelope, or, Love's labour lost : a novel",,,Penelope
574,SC0662,1828,1828,Scott Walter Sir 1771 1832,"Scott, Walter",Woodstock or The cavalier a tale of the year sixteen hundred and fifty one,"Woodstock, or, The cavalier : a tale of the year sixteen hundred and fifty-one",Historical,"Sutherland, John. The Longman Companion to Victorian Fiction. 2nd ed. Harlow, England: Pearson Longman, 2009.",Woodstock
575,SC0663,1828,1828,"Scott, Lady (Caroline Lucy)",Lady Charlotte Bury,A marriage in high life Edited by the authoress of Flirtation,Flirtation,Silver Fork,"Adburgham, Alison. ""Bibliographies, Silver Fork Novels"". Silver Fork Society : Fashionable Life and Literature From 1814 to 1840. London: Constable, 1983. 320-332.",Flirtation
576,SC0665,1828,1828,Smith Horace 1779 1849,"Smith, Horace",Zillah a tale of the Holy City,Zillah; a tale of the Holy City,,,Zillah
577,SC0668,1828,1828,White Charles 1793 1861,White Charles,Herbert Milton,Almack's Revisited | Herbert Milton,Silver Fork,"Adburgham, Alison. �Bibliographies, Silver Fork Novels�. Silver Fork Society : Fashionable Life and Literature From 1814 to 1840. London: Constable, 1983. 320-332.",Almack's Revisited | Herbert Milton
578,SC0669,1829,1829,Anonymous,Anonymous,The Davenels or a campaign of fashion in Dublin,"The Davenels; or, a campaign of fashion in Dublin",,,The Davenels
579,SC0670,1829,1829,Anwyl Edward Trevor,Anwyl Edward Trevor,Reginald Trevor or The Welsh Loyalists a tale of the seventeenth century,"Reginald Trevor : or, The Welsh Loyalists, a tale of the seventeenth century",Historical,Schöwerling,Reginald Trevor
580,SC0671,1829,1829,"Appleton, Miss","Appleton, Miss",Leonora or The presentation at court being the first of a series of narratives called Young ladies tales,"Leonora : or, The presentation at court : being the first of a series of narratives called Young ladies' tales",,,Leonora
581,SC0672,1829,1829,"Beamish, North Ludlow","Beamish, North Ludlow",Peace campaigns of a cornet,Peace campaigns of a cornet,,,Peace campaigns of a cornet
582,SC0673,1829,1829,Carne John 1789 1844,Carne John,Stratton hill a tale of the civil wars,Stratton hill : a tale of the civil wars,,,Stratton hill
583,SC0674,1829,1829,Crumpe Miss,Crumpe Miss,Geraldine of Desmond or Ireland in the reign of Elizabeth an historical romance,"Geraldine of Desmond, or, Ireland in the reign of Elizabeth : an historical romance",Historical,title inference,Geraldine of Desmond
584,SC0675,1829,1829,Glascock W N William Nugent 1787 1847,"Glascock, William Nugent W N",Sailors and saints or matrimonial manoeuvres,"Sailors and saints : or, matrimonial manoeuvres",Nautical,"""ART. VII –Tales of Military and Naval Life."" The Edinburgh Review. Vol LII, No. CIII (1830): 119-138.",Sailors and saints
585,SC0676,1829,1829,Gore Mrs Catherine Grace Frances 1799 1861,"Gore, Mrs. (Catherine Grace Frances)",Hungarian tales,Hungarian tales,,,Hungarian tales
586,SC0677,1829,1829,Gore Mrs Catherine Grace Frances 1799 1861,"Gore, Mrs. (Catherine Grace Frances)",Romances of real life,Romances of real life.,,,Romances of real life
587,SC0678,1829,1829,Grattan Thomas Colley 1792 1864,"Grattan, Thomas Colley",Traits of travel or Tales of men and cities,"Traits of travel; or, Tales of men and cities",,,Traits of travel
588,SC0679,1829,1829,Grey Elizabeth Caroline,"Grey, Mrs. Elizabeth Caroline",The trials of life,The trials of life,,,The trials of life
589,SC0680,1829,1829,Head Miss,Head Miss,Rybrent de Cruce,Rybrent de Cruce ..,,,Rybrent de Cruce
590,SC0681,1829,1829,Hogg James 1770 1835,"Hogg, James",The shepherd s calendar,The shepherd's calendar,,,The shepherd's calendar
